{
  "version": "1.0.0",
  "repository": "valo.tofoo",
  "standing": "INFORMATIVE_RESEARCH_ONLY",
  "frontiers": [
    {
      "lineage_header": {
        "origin": "CLAIM_REGISTRY.md#C-PHI-001",
        "parents": [],
        "status": "speculative",
        "evidence_refs": [
          "CLAIM_REGISTRY.md#C-PHI-001",
          "docs/theories/tofoo_falsification_backlog.md#F-PHI-001"
        ]
      },
      "id": "FG-001",
      "title": "Large-model coherence interval",
      "axes": [
        "WHAT",
        "HOW"
      ],
      "status": "OPEN",
      "priority": "MEDIUM",
      "epistemic_status": "hypothesis",
      "question": "Does the proposed dimensionless coherence interval [0.5615, 0.8319] hold for independently measured large language models beyond the current small model set?",
      "current_understanding": "The claim registry records a proposed coherence interval with measurements on six models and no independent 70B+ confirmation.",
      "unresolved": "The available evidence does not establish that the interval generalizes to large models or architectures outside the current measurement set.",
      "contradictions": [],
      "falsifier_or_decisive_test": "Measure dimensionless tau on at least three 70B+ models; a well-calibrated large model consistently outside the proposed interval across independent runs would falsify the claim as currently stated.",
      "next_gate": "Run the pending 70B+ measurement program with fixed instrumentation and publish raw measurements and calibration details.",
      "source_refs": [
        {
          "path": "CLAIM_REGISTRY.md",
          "claim_or_test_id": "C-PHI-001",
          "purpose": "Current claim maturity and evidence boundary."
        },
        {
          "path": "docs/theories/tofoo_falsification_backlog.md",
          "claim_or_test_id": "F-PHI-001",
          "purpose": "Registered falsification test and pending hardware dependency."
        }
      ],
      "related_frontiers": [
        "FG-002"
      ],
      "lineage": {
        "revision": 1,
        "parent_revision": null,
        "change_note": "Seeded from the registered C-PHI-001 / F-PHI-001 unresolved test."
      }
    },
    {
      "lineage_header": {
        "origin": "CLAIM_REGISTRY.md#C-PHI-002",
        "parents": [],
        "status": "evidence-backed",
        "evidence_refs": [
          "CLAIM_REGISTRY.md#C-PHI-002",
          "docs/theories/tofoo_falsification_backlog.md#F-PHI-002"
        ]
      },
      "id": "FG-002",
      "title": "Cross-architecture tau scaling",
      "axes": [
        "WHAT",
        "WHY",
        "HOW"
      ],
      "status": "OPEN",
      "priority": "MEDIUM",
      "epistemic_status": "empirical_observation",
      "question": "Is tau approximately proportional to 0.10 × N^0.48 across independent architecture families, or is the observed exponent specific to the current dataset?",
      "current_understanding": "The claim registry records an empirical scaling fit based on a limited set including GPT-2, Phi-2 and Mistral-7B.",
      "unresolved": "Independent architecture families and multiple sizes per family have not yet established a cross-architecture exponent.",
      "contradictions": [],
      "falsifier_or_decisive_test": "Measure at least three additional architecture families across multiple sizes; exponent outside [0.43, 0.53] or prefactor outside [0.07, 0.13] on an independent family would falsify the current cross-architecture claim.",
      "next_gate": "Build a preregistered measurement matrix for Mistral, Falcon and Gemma families and estimate uncertainty around exponent and prefactor.",
      "source_refs": [
        {
          "path": "CLAIM_REGISTRY.md",
          "claim_or_test_id": "C-PHI-002",
          "purpose": "Current empirical scaling claim and maturity."
        },
        {
          "path": "docs/theories/tofoo_falsification_backlog.md",
          "claim_or_test_id": "F-PHI-002",
          "purpose": "Cross-architecture falsification thresholds."
        }
      ],
      "related_frontiers": [
        "FG-001",
        "FG-009"
      ],
      "lineage": {
        "revision": 1,
        "parent_revision": null,
        "change_note": "Seeded from C-PHI-002 / F-PHI-002."
      }
    },
    {
      "lineage_header": {
        "origin": "CLAIM_REGISTRY.md#C-LIM-001",
        "parents": [],
        "status": "speculative",
        "evidence_refs": [
          "CLAIM_REGISTRY.md#C-LIM-001",
          "docs/theories/tofoo_falsification_backlog.md#F-LIM-001"
        ]
      },
      "id": "FG-003",
      "title": "Operational identity criterion",
      "axes": [
        "WHAT",
        "WHO",
        "HOW"
      ],
      "status": "OPEN",
      "priority": "LOW",
      "epistemic_status": "hypothesis",
      "question": "Can the LIM statement that identity is what survives boundary-governed transformation over time be restated as an operational, falsifiable criterion without collapsing representation continuity into personal identity?",
      "current_understanding": "C-LIM-001 is explicitly M0/M1 and the falsification backlog states that it is not falsifiable as currently phrased.",
      "unresolved": "There is no operational definition that yields a yes/no test for identity across a boundary-governed transformation.",
      "contradictions": [
        "The claim is presently meaningful as conceptual framing but cannot yet carry empirical standing."
      ],
      "falsifier_or_decisive_test": "First define an operational criterion and a transformation test protocol; until that exists, no empirical falsification is available.",
      "next_gate": "Produce competing operational definitions that preserve the representation/person distinction and identify discriminating test cases for each.",
      "source_refs": [
        {
          "path": "CLAIM_REGISTRY.md",
          "claim_or_test_id": "C-LIM-001",
          "purpose": "Explicit M0/M1 status and person-boundary warning."
        },
        {
          "path": "docs/theories/tofoo_falsification_backlog.md",
          "claim_or_test_id": "F-LIM-001",
          "purpose": "Registered requirement for operational reformulation."
        }
      ],
      "related_frontiers": [
        "FG-010"
      ],
      "lineage": {
        "revision": 1,
        "parent_revision": null,
        "change_note": "Seeded from the unresolved operationalization requirement for LIM identity."
      }
    },
    {
      "lineage_header": {
        "origin": "CLAIM_REGISTRY.md#C-LIM-002",
        "parents": [],
        "status": "speculative",
        "evidence_refs": [
          "CLAIM_REGISTRY.md#C-LIM-002",
          "docs/theories/tofoo_falsification_backlog.md#F-LIM-002"
        ]
      },
      "id": "FG-004",
      "title": "LIM-to-VALO bridge necessity",
      "axes": [
        "WHY",
        "HOW"
      ],
      "status": "OPEN",
      "priority": "MEDIUM",
      "epistemic_status": "hypothesis",
      "question": "Which, if any, LIM-derived principles are actually necessary for VALO governance invariants rather than merely explanatory or structurally analogous?",
      "current_understanding": "C-LIM-002 records a structural bridge between Tofoo meaning and VALO execution, but the dependency has not been formally tested.",
      "unresolved": "It is unknown whether VALO retains all governance invariants when LIM-derived constraints are removed from the analysis.",
      "contradictions": [],
      "falsifier_or_decisive_test": "Demonstrate a VALO runtime or formal model that preserves its governance invariants without any LIM-derived constraint; that would falsify necessity as currently stated.",
      "next_gate": "Construct a dependency matrix separating descriptive analogy from constraints that are demonstrably required by VALO invariants.",
      "source_refs": [
        {
          "path": "CLAIM_REGISTRY.md",
          "claim_or_test_id": "C-LIM-002",
          "purpose": "Current bridge claim and M2 standing."
        },
        {
          "path": "docs/theories/tofoo_falsification_backlog.md",
          "claim_or_test_id": "F-LIM-002",
          "purpose": "Registered dependency falsification test."
        }
      ],
      "related_frontiers": [
        "FG-003"
      ],
      "lineage": {
        "revision": 1,
        "parent_revision": null,
        "change_note": "Seeded from C-LIM-002 / F-LIM-002."
      }
    },
    {
      "lineage_header": {
        "origin": "CLAIM_REGISTRY.md#C-FR-005",
        "parents": [],
        "status": "speculative",
        "evidence_refs": [
          "CLAIM_REGISTRY.md#C-FR-005",
          "docs/theories/tofoo_falsification_backlog.md#F-FR-005"
        ]
      },
      "id": "FG-005",
      "title": "Fleet-routing PoA denominator",
      "axes": [
        "WHAT",
        "WHY",
        "HOW"
      ],
      "status": "OPEN",
      "priority": "HIGH",
      "epistemic_status": "hypothesis",
      "question": "What is the correct social-welfare objective for the fleet-routing model, and does it support PoA = 1.2622?",
      "current_understanding": "The backlog records that the standard denominator yields PoA = 6.09, while 1.2622 is recoverable only under an ungrounded interpretation C.",
      "unresolved": "The denominator corresponding to the true social-welfare objective has not been derived and justified.",
      "contradictions": [
        "The registered 1.2622 value conflicts with the standard-denominator calculation of 6.09."
      ],
      "falsifier_or_decisive_test": "Derive the social-welfare objective from the demand model. If it is the standard x_opt·l(x_opt) objective, the 1.2622 claim fails.",
      "next_gate": "Specify the demand model and derive the welfare denominator from first principles before further PoA claims are promoted.",
      "source_refs": [
        {
          "path": "CLAIM_REGISTRY.md",
          "claim_or_test_id": "C-FR-005",